{
  "schema_version": "1.0.0",
  "id": "composite-course",
  "version": "1.0.0",
  "title": "Corso composto",
  "school_year": "2026/2027",
  "target_class": "4^",
  "language": "it",
  "authors": [{"name": "Docente", "role": "author"}],
  "license": "proprietary",
  "content": {
    "units": [
      {
        "id": "u-local",
        "title": "Unità locale",
        "order": 1,
        "materials": ["materials/local.md"]
      }
    ]
  },
  "imports": [
    {
      "bundle_id": "tpsi-quarto-2026",
      "version": "1.0.0",
      "source_type": "git",
      "source_url": "https://github.com/TheBitPoets/tpsi-quarto-docente",
      "tag": "v1.0.0",
      "commit_sha": "89abcdef0123456789abcdef0123456789abcdef",
      "all": true
    }
  ]
}
